{
  "schema_version": 1,
  "catalog_id": "nosey-built-in",
  "snapshot_date": "2026-10-31",
  "source": "Nosey modular product specification; October 28 user-supplied skill mappings",
  "counts": {
    "technologies": 246,
    "mapped_technologies": 177,
    "detect_only_technologies": 69,
    "combinations": 33,
    "distinct_referenced_skills": 746
  },
  "detection_coverage_note": "Mapped technologies have only the evidence examples published in the source summary, not guaranteed exhaustive detector definitions. Detect-only technologies lack documented per-technology criteria; their generated IDs are provisional.",
  "repository_aliases": {
    "affaan-m/everything-claude-code": "affaan-m/ECC"
  },
  "technologies": [
    {
      "id": "anthropic-sdk",
      "name": "Anthropic SDK",
      "category": "AI, LLM and MCP",
      "mapping_status": "mapped",
      "detection": {
        "coverage": "documented_examples_only",
        "signals": [
          {
            "kind": "npm",
            "examples": [
              "@anthropic-ai/sdk"
            ]
          },
          {
            "kind": "py",
            "examples": [
              "anthropic"
            ]
          }
        ],
        "raw": "npm: `@anthropic-ai/sdk`; py: `anthropic`"
      },
      "skill_ids": [
        "anthropics/skills/claude-api"
      ],
      "source_document": "specification/04-catalog/09-technology-mappings/08-ai-llm-mcp.md",
      "id_provenance": "explicit_in_specification"
    },
    {
      "id": "chrome-devtools-mcp",
      "name": "Chrome DevTools MCP",
      "category": "AI, LLM and MCP",
      "mapping_status": "detect_only",
      "detection": {
        "coverage": "undocumented",
        "signals": [],
        "raw": ""
      },
      "skill_ids": [],
      "source_document": "specification/04-catalog/09-technology-mappings/08-ai-llm-mcp.md",
      "id_provenance": "derived_from_display_name_not_explicit_in_specification"
    },
    {
      "id": "cloudflare-agents",
      "name": "Cloudflare Agents",
      "category": "AI, LLM and MCP",
      "mapping_status": "mapped",
      "detection": {
        "coverage": "documented_examples_only",
        "signals": [
          {
            "kind": "npm",
            "examples": [
              "agents"
            ]
          }
        ],
        "raw": "npm: `agents`"
      },
      "skill_ids": [
        "cloudflare/skills/agents-sdk",
        "cloudflare/skills/sandbox-stable"
      ],
      "source_document": "specification/04-catalog/09-technology-mappings/08-ai-llm-mcp.md",
      "id_provenance": "explicit_in_specification"
    },
    {
      "id": "cloudflare-ai",
      "name": "Cloudflare AI",
      "category": "AI, LLM and MCP",
      "mapping_status": "mapped",
      "detection": {
        "coverage": "documented_examples_only",
        "signals": [
          {
            "kind": "npm",
            "examples": [
              "@cloudflare/ai"
            ]
          },
          {
            "kind": "content_match",
            "examples": [],
            "details_documented": false
          }
        ],
        "raw": "npm: `@cloudflare/ai`; content match"
      },
      "skill_ids": [
        "cloudflare/skills/agents-sdk"
      ],
      "source_document": "specification/04-catalog/09-technology-mappings/08-ai-llm-mcp.md",
      "id_provenance": "explicit_in_specification"
    },
    {
      "id": "context7-mcp",
      "name": "Context7 MCP",
      "category": "AI, LLM and MCP",
      "mapping_status": "detect_only",
      "detection": {
        "coverage": "undocumented",
        "signals": [],
        "raw": ""
      },
      "skill_ids": [],
      "source_document": "specification/04-catalog/09-technology-mappings/08-ai-llm-mcp.md",
      "id_provenance": "derived_from_display_name_not_explicit_in_specification"
    },
    {
      "id": "firecrawl",
      "name": "Firecrawl",
      "category": "AI, LLM and MCP",
      "mapping_status": "mapped",
      "detection": {
        "coverage": "documented_examples_only",
        "signals": [
          {
            "kind": "npm",
            "examples": [
              "@mendable/firecrawl-js"
            ]
          },
          {
            "kind": "py",
            "examples": [
              "firecrawl-py"
            ]
          }
        ],
        "raw": "npm: `@mendable/firecrawl-js`; py: `firecrawl-py`"
      },
      "skill_ids": [
        "firecrawl/cli/firecrawl"
      ],
      "source_document": "specification/04-catalog/09-technology-mappings/08-ai-llm-mcp.md",
      "id_provenance": "explicit_in_specification"
    },
    {
      "id": "google-genai",
      "name": "Google Gen AI",
      "category": "AI, LLM and MCP",
      "mapping_status": "mapped",
      "detection": {
        "coverage": "documented_examples_only",
        "signals": [
          {
            "kind": "npm",
            "examples": [
              "@google/genai"
            ]
          },
          {
            "kind": "py",
            "examples": [
              "google-genai"
            ]
          }
        ],
        "raw": "npm: `@google/genai`; py: `google-genai`"
      },
      "skill_ids": [
        "google-gemini/gemini-skills/gemini-api-dev"
      ],
      "source_document": "specification/04-catalog/09-technology-mappings/08-ai-llm-mcp.md",
      "id_provenance": "explicit_in_specification"
    },
    {
      "id": "hugging-face",
      "name": "Hugging Face",
      "category": "AI, LLM and MCP",
      "mapping_status": "mapped",
      "detection": {
        "coverage": "undocumented",
        "signals": [],
        "raw": ""
      },
      "skill_ids": [
        "K-Dense-AI/scientific-agent-skills/transformers"
      ],
      "source_document": "specification/04-catalog/09-technology-mappings/08-ai-llm-mcp.md",
      "id_provenance": "derived_from_display_name_not_explicit_in_specification"
    },
    {
      "id": "langchain",
      "name": "LangChain",
      "category": "AI, LLM and MCP",
      "mapping_status": "mapped",
      "detection": {
        "coverage": "documented_examples_only",
        "signals": [
          {
            "kind": "npm",
            "examples": [
              "langchain"
            ]
          },
          {
            "kind": "py",
            "examples": [
              "langchain",
              "langchain-core",
              "langchain-openai"
            ],
            "additional_unlisted_examples": 1
          },
          {
            "kind": "npm_pattern",
            "examples": [],
            "reported_pattern_count": 1,
            "details_documented": false
          }
        ],
        "raw": "npm: `langchain`; py: `langchain`, `langchain-core`, `langchain-openai` +1; npm pattern: 1"
      },
      "skill_ids": [
        "langchain-ai/langchain-skills/langchain-rag"
      ],
      "source_document": "specification/04-catalog/09-technology-mappings/08-ai-llm-mcp.md",
      "id_provenance": "explicit_in_specification"
    },
    {
      "id": "langfuse",
      "name": "Langfuse",
      "category": "AI, LLM and MCP",
      "mapping_status": "mapped",
      "detection": {
        "coverage": "documented_examples_only",
        "signals": [
          {
            "kind": "npm",
            "examples": [
              "langfuse",
              "@langfuse/tracing"
            ]
          },
          {
            "kind": "py",
            "examples": [
              "langfuse"
            ]
          }
        ],
        "raw": "npm: `langfuse`, `@langfuse/tracing`; py: `langfuse`"
      },
      "skill_ids": [
        "langfuse/skills/langfuse"
      ],
      "source_document": "specification/04-catalog/09-technology-mappings/08-ai-llm-mcp.md",
      "id_provenance": "explicit_in_specification"
    },
    {
      "id": "langgraph",
      "name": "LangGraph",
      "category": "AI, LLM and MCP",
      "mapping_status": "mapped",
      "detection": {
        "coverage": "documented_examples_only",
        "signals": [
          {
            "kind": "npm",
            "examples": [
              "@langchain/langgraph"
            ]
          },
          {
            "kind": "py",
            "examples": [
              "langgraph"
            ]
          }
        ],
        "raw": "npm: `@langchain/langgraph`; py: `langgraph`"
      },
      "skill_ids": [
        "langchain-ai/deepagents/langgraph-docs"
      ],
      "source_document": "specification/04-catalog/09-technology-mappings/08-ai-llm-mcp.md",
      "id_provenance": "explicit_in_specification"
    },
    {
      "id": "litellm",
      "name": "LiteLLM",
      "category": "AI, LLM and MCP",
      "mapping_status": "detect_only",
      "detection": {
        "coverage": "undocumented",
        "signals": [],
        "raw": ""
      },
      "skill_ids": [],
      "source_document": "specification/04-catalog/09-technology-mappings/08-ai-llm-mcp.md",
      "id_provenance": "derived_from_display_name_not_explicit_in_specification"
    },
    {
      "id": "llamaindex",
      "name": "LlamaIndex",
      "category": "AI, LLM and MCP",
      "mapping_status": "detect_only",
      "detection": {
        "coverage": "undocumented",
        "signals": [],
        "raw": ""
      },
      "skill_ids": [],
      "source_document": "specification/04-catalog/09-technology-mappings/08-ai-llm-mcp.md",
      "id_provenance": "derived_from_display_name_not_explicit_in_specification"
    },
    {
      "id": "mastra",
      "name": "Mastra",
      "category": "AI, LLM and MCP",
      "mapping_status": "mapped",
      "detection": {
        "coverage": "documented_examples_only",
        "signals": [
          {
            "kind": "npm",
            "examples": [
              "@mastra/core"
            ]
          }
        ],
        "raw": "npm: `@mastra/core`"
      },
      "skill_ids": [
        "mastra-ai/skills/mastra"
      ],